{
  "$schema": "../../schemas/skill.schema.json",
  "name": "tdd",
  "status": "stable",
  "description": "Build features or fix bugs with red-green-refactor. Test-first, behavior-driven, no shortcuts.",

  "chain": {
    "from": ["breakdown"],
    "to": [
      { "target": "review", "type": "clean", "guard": "¬REM" },
      { "target": "tdd", "type": "clean", "guard": "REM·¬NEXT_HITL" },
      { "target": "tdd", "type": "gate", "guard": "REM·NEXT_HITL" },
      { "target": "wrapup", "type": "gate" }
    ]
  },

  "steps": [
    {
      "id": "plan",
      "name": "Plan",
      "reads": ["TESTING.md", "CONVENTIONS.md", "GLOSSARY.md"],
      "process": "process/tdd.md#plan",
      "references": ["../../schemas/routing-policy.json", "../../schemas/test-selection.json"],
      "instruction": "Read project context + ADRs in touched area. Confirm behavior list and interface design with user. Read slice test annotations (facets, layers, permutations). If missing, enumerate as failsafe per test-selection.json.",
      "checklist": [
        "Behavior list and interface confirmed with user",
        "Slice test annotations read or failsafe-enumerated",
        "Test layers match cheapest-falsifying-layer principle"
      ]
    },
    {
      "id": "endpoint-check",
      "name": "Endpoint scope check",
      "enterprise": true,
      "reads": ["contracts/*-endpoints.json"],
      "instruction": "Verify slice covers every 'in' endpoint per registry. Read issue tracker if issue exists for this slice.",
      "checklist": [
        "Every 'in' endpoint for this slice covered",
        "Issue acceptance criteria noted"
      ]
    },
    {
      "id": "tracer",
      "name": "Tracer bullet",
      "process": "process/tdd.md#tracer",
      "instruction": "Write one E2E test exercising happy path through public interface. Must fail (red).",
      "checklist": [
        "E2E happy-path test written and failing"
      ]
    },
    {
      "id": "loop",
      "name": "Incremental loop",
      "process": "process/tdd.md#loop",
      "instruction": "Per behavior: failing test (red), minimal implementation (green), refactor. Show user each test before implementing. Same failure without new evidence = leave patch loop per routing-policy rerouting.",
      "per_cycle_checklist": [
        "Test describes behavior via public interface, survives refactor",
        "Code minimal for this test, no speculative features",
        "Persistent failures escalated per loop budget"
      ]
    },
    {
      "id": "refactor",
      "name": "Refactor",
      "references": [
        "reference/tests.md",
        "reference/mocking.md",
        "reference/deep-modules.md",
        "reference/interface-design.md",
        "reference/refactoring.md",
        "../../schemas/test-selection.json"
      ],
      "process": "process/tdd.md#refactor",
      "instruction": "Clean up implementation and tests per reference docs. Write slice done marker if complete (reference/slice-marker.md).",
      "checklist": [
        "Interfaces deep, duplication eliminated, no test smells",
        "Tests use cheapest falsifying layer, no circular oracles",
        "Slice done marker written if complete"
      ]
    },
    {
      "id": "convention-check",
      "name": "Convention enforcement",
      "enterprise": true,
      "reads": ["process/convention-enforcement.md"],
      "instruction": "Verify convention-enforcement tests pass. Offer new convention test if repeating pattern emerged.",
      "checklist": [
        "Convention tests pass (if they exist)",
        "New convention test offered if pattern detected"
      ]
    }
  ],

  "safety_rails": {
    "banned_ops": ["git rebase", "git push --force", "az", "aws", "gcloud"],
    "on_banned": "print_for_user"
  },

  "capabilities": {
    "scope_protection": false,
    "safety_rails": true,
    "convention_enforcement": true,
    "enterprise_context": true,
    "catalogue_grill": false
  },

  "engagement": {
    "emits": ["concerns"],
    "writes": ["per-slice done marker"],
    "override": "commit-producing",
    "manifest": true,
    "chain_dispatch": true
  },

  "tone": "Disciplined. One test, one implementation, no shortcuts."
}
