{
  "$schema": "../../schemas/skill.schema.json",
  "name": "wrapup",
  "status": "stable",
  "description": "Resolve concerns, cascade to shared docs, evaluate gate.",

  "chain": {
    "from": ["tdd"],
    "to": [
      { "target": "review", "type": "gate" },
      { "target": "ship", "type": "gate" }
    ]
  },

  "steps": [
    {
      "id": "gather-concerns",
      "name": "Gather concerns",
      "reads": ["CONCERNS.md"],
      "instruction": "Read CONCERNS.md. Filter open concerns referencing current entity (by refs or name). Include session-emitted concerns.",
      "checklist": ["Entity-related concerns gathered"]
    },
    {
      "id": "spec-drift",
      "name": "Spec drift check",
      "instruction": "Re-read entity docs (spec, logic doc). Compare field-by-field against what was built: count, types, edge cases, errors, naming vs GLOSSARY.md. Mismatches become concerns (type: issue). No docs: report skipped, continue.",
      "checklist": ["Drift check done or skipped"]
    },
    {
      "id": "resolve",
      "name": "Resolve concerns",
      "instruction": "For each concern: (1) read authoritative source, (2) write/run test to prove which side correct, (3) escalate only if ambiguous. Never skip to 3. Update spec, fix code, or both. Mark resolved in CONCERNS.md with date and decision. Recalculate summary header.",
      "checklist": ["Each concern resolved via cascade", "CONCERNS.md updated"]
    },
    {
      "id": "scope-validation",
      "name": "Scope validation",
      "enterprise": true,
      "reads": ["contracts/*-endpoints.json"],
      "references": ["../../schemas/routing-policy.json"],
      "instruction": "Verify completed work covers all 'in' items. Missing coverage = BLOCK concern. Verify obligation completion per routing policy. Coverage gaps prevent verified status.",
      "checklist": ["Scope coverage verified", "Obligation completion checked"]
    },
    {
      "id": "cascade",
      "name": "Cascade to shared docs",
      "reads": [],
      "instruction": "Cascade resolutions: naming -> ## Conventions in CLAUDE.md, scope -> ## Scope in CLAUDE.md, dependencies -> ## Architecture in CLAUDE.md. Milestone concerns: offer archival.",
      "checklist": ["Affected docs updated"]
    },
    {
      "id": "evaluate-gate",
      "name": "Evaluate gate and report",
      "instruction": "Check gate: items remaining, conditions satisfied, blocking concerns. Blocking verdict is authoritative for /ship. Archive resolved if threshold exceeded. Report: '{entity}: {N} resolved, {M} escalated. Blocking: {list}. Gate: {X}/{Y} met.' Produce handoff packet: changes + requirements satisfied, data flow with boundaries, evidence table with blocked/untested claims.",
      "checklist": ["Gate evaluated", "Blocking verdict authored", "Handoff packet produced"]
    }
  ],

  "capabilities": {
    "scope_protection": true,
    "safety_rails": false,
    "convention_enforcement": false,
    "enterprise_context": true,
    "catalogue_grill": false
  },

  "engagement": {
    "emits": ["issues", "resolution notes"],
    "writes": ["CONCERNS.md", "docs/_local/handoffs/"],
    "override": "cascade only fires for docs that exist",
    "manifest": true,
    "chain_dispatch": true
  },

  "tone": "Brief and mechanical. Resolve, cascade, report."
}
