{
  "$schema": "../../schemas/skill.schema.json",
  "name": "migrate",
  "status": "deprecated",
  "description": "Replace an existing system layer by layer until the new application is complete. Extends /setup, run once at start.",

  "chain": {
    "from": [],
    "to": []
  },

  "steps": [
    {
      "id": "prerequisites",
      "name": "Prerequisites and scope protection",
      "reads": ["contracts/*-endpoints.json", "docs/implementation/parity/*.csv"],
      "references": ["reference/migration-structure.md", "reference/references.md"],
      "instruction": "Verify /setup ran (CLAUDE.md exists with ## Scope and ## Architecture sections). Read endpoint registries. All source features IN unless explicitly cut with reason and owner. Parity system (entity registries, endpoint maps) is authoritative scope if exists.",
      "checklist": [
        "/setup ran, scope docs read",
        "All source features IN unless explicitly cut",
        "Parity system read if exists"
      ]
    },
    {
      "id": "phase-dispatch",
      "name": "Phase dispatch",
      "reads": ["CLAUDE.md"],
      "instruction": "Read Active Workflow from CLAUDE.md for current phase. Route to phases/{NN}-{name}.md. 7 phases: docs sprint, vertical slice, horizontal buildout, integration, functional validation, design pass, cutover. No workflow record -> start phase 1, write record.",
      "checklist": [
        "Phase identified and routed"
      ]
    },
    {
      "id": "wrapup-and-advance",
      "name": "Wrapup and phase advance",
      "instruction": "At phase boundaries: suggest /wrapup. Evaluate gate criteria from phase file. Pass -> advance phase in CLAUDE.md, announce next. Fail -> list unmet, propose work. Final phase (cutover) -> mark completed with date.",
      "checklist": [
        "Gate evaluated, phase advanced or gaps listed"
      ]
    }
  ],

  "capabilities": {
    "scope_protection": true,
    "safety_rails": false,
    "convention_enforcement": false,
    "enterprise_context": true,
    "catalogue_grill": false
  },

  "engagement": {
    "emits": ["concerns"],
    "writes": ["Active Workflow in CLAUDE.md"],
    "override": "workflow skill",
    "manifest": true,
    "chain_dispatch": false
  },

  "tone": "Methodical. Every feature in the source system is accounted for."
}
