{
  "$schema": "../../schemas/skill.schema.json",
  "name": "breakdown",
  "status": "stable",
  "description": "Decompose spec into implementable slices with dependency ordering.",

  "chain": {
    "from": ["spec"],
    "to": [
      { "target": "tdd", "type": "clean", "guard": "SLICED·REM·¬NEXT_HITL" },
      { "target": "tdd", "type": "gate", "guard": "SLICED·REM·NEXT_HITL" }
    ]
  },

  "steps": [
    {
      "id": "read-spec",
      "name": "Read and understand",
      "reads": [],
      "instruction": "Read spec (Documentation Map or docs/specs/{feature}.md). Identify entities, behaviors, dependencies, scope boundaries. No spec? Suggest /spec. Never add features spec does not describe. Flag ambiguity as concern.",
      "checklist": [
        "Spec read, entities and behaviors identified",
        "Dependencies mapped, scope boundaries checked"
      ]
    },
    {
      "id": "scope-guard",
      "name": "Scope guard",
      "enterprise": true,
      "reads": ["contracts/*-endpoints.json"],
      "instruction": "Every 'in' endpoint must trace to at least one slice. Never cut endpoint or feature without explicit user approval. Cost not reason to cut. Flag, don't decide.",
      "checklist": [
        "Every 'in' endpoint traceable to planned slice",
        "No features cut without user approval"
      ]
    },
    {
      "id": "decompose",
      "name": "Decompose into slices",
      "references": ["../../schemas/routing-policy.json", "../../schemas/test-selection.json"],
      "instruction": "Each slice: implementable in one session, testable (clear done condition), scoped (~5 files max), ordered (explicit deps). One slice per screen, endpoint, or behavioral unit. Tag Autonomy: afk|hitl. afk only when done-condition machine-verifiable and no load-bearing surface (## Deployment in CLAUDE.md) touched. Annotate each with impact facets from routing-policy.json. Include test layers and permutations from spec.",
      "checklist": [
        "Each slice: one session, clear done, bounded files, explicit deps",
        "Every slice tagged afk or hitl",
        "Impact facets and test layers annotated per slice"
      ]
    },
    {
      "id": "validate",
      "name": "Validate against scope",
      "instruction": "Every acceptance criterion covered by at least one slice. Every slice traces to at least one criterion. Flag uncovered criteria as gaps, untraceable slices as scope creep. Verify test permutations from spec covered.",
      "checklist": [
        "Bidirectional trace: criteria to slices, slices to criteria",
        "Gaps and scope creep flagged",
        "Test permutations traced to slices"
      ]
    },
    {
      "id": "write",
      "name": "Write slices",
      "instruction": "Check slice storage convention. J1 rules or issue tracker preference: create Linear/GitHub issues with acceptance checkboxes, autonomy tags, dep links. Otherwise: append ## Implementation Slices to spec file. Never modify existing spec content.",
      "checklist": [
        "Storage convention checked, slices written to correct destination",
        "Existing spec content not modified"
      ]
    }
  ],

  "capabilities": {
    "scope_protection": true,
    "safety_rails": false,
    "convention_enforcement": false,
    "enterprise_context": true,
    "catalogue_grill": false
  },

  "engagement": {
    "emits": ["concerns"],
    "writes": [],
    "manifest": true,
    "chain_dispatch": true
  },

  "tone": "Precise. Each slice is a contract for the implementer."
}
