{
  "$schema": "../../schemas/skill.schema.json",
  "name": "prototype",
  "status": "stable",
  "description": "Build throwaway prototypes. Duplicate existing components, wire to variant switcher.",

  "chain": {
    "from": [],
    "to": []
  },

  "steps": [
    {
      "id": "detect-branch",
      "name": "Detect prototype branch",
      "reads": ["CONVENTIONS.md", "ARCHITECTURE.md"],
      "references": ["phases/logic.md", "phases/ui.md", "phases/design.md"],
      "instruction": "Select branch: Logic (TUI/CLI for functional validation), UI (duplicate components + variant switcher), Design (token toggle panel). For Design: load design-sensibility.md.",
      "checklist": [
        "Branch selected (logic/ui/design)",
        "Design-sensibility loaded if Design branch"
      ]
    },
    {
      "id": "scaffold",
      "name": "Scaffold prototype",
      "instruction": "Never create standalone artifacts. UI: duplicate existing component(s), wire variant switcher for toggling original vs N variants in actual app layout. Logic: throwaway script/TUI. Design: toggle panel with token overrides.",
      "checklist": [
        "Components duplicated in context (not isolated)",
        "Variant switcher wired (UI branch)"
      ]
    },
    {
      "id": "iterate",
      "name": "Iterate and compare",
      "instruction": "Build meaningfully different variations (structural, not just color). Compare via variant switcher. Evaluate each against all 9 interaction states. Test dense/narrow/empty/error layouts.",
      "checklist": [
        "Multiple variations built and compared",
        "Interaction states and edge layouts tested",
        "Decision captured (which variant, why)"
      ]
    },
    {
      "id": "extract-or-discard",
      "name": "Extract or discard",
      "instruction": "Chosen variant: extract as new implementation, remove switcher and other variants. Learning goal: discard all, document findings. Clean up.",
      "checklist": [
        "Chosen variant extracted or all discarded",
        "Prototype artifacts cleaned up"
      ]
    }
  ],

  "capabilities": {
    "scope_protection": false,
    "safety_rails": false,
    "convention_enforcement": false,
    "enterprise_context": false,
    "catalogue_grill": false
  },

  "engagement": {
    "emits": ["concerns"],
    "writes": [],
    "manifest": true,
    "chain_dispatch": false
  },

  "tone": "Fast and rough. Prototypes validate ideas, not ship code."
}
