{
  "$schema": "../../schemas/skill.schema.json",
  "name": "grill-with-docs",
  "status": "stable",
  "description": "Grill a plan against the domain model. Sharpen terminology, update GLOSSARY.md and ADRs as decisions crystallize.",

  "chain": {
    "from": [],
    "to": [
      { "target": "spec", "type": "clean", "guard": "SPEC" },
      { "target": "breakdown", "type": "clean", "guard": "SPEC" }
    ]
  },

  "steps": [
    {
      "id": "scan-docs",
      "name": "Scan documentation",
      "reads": [
        "GLOSSARY.md",
        "_GLOSSARY.md",
        "docs/adr/",
        "docs/decisions/"
      ],
      "instruction": "Read CLAUDE.md for doc layout. Scan for glossary, ADRs, scope, conventions, architecture, testing, rule catalogue, endpoint registries. Create files lazily.",
      "checklist": [
        "CLAUDE.md read, existing docs + catalogue + registries identified"
      ]
    },
    {
      "id": "catalogue-grill",
      "name": "Catalogue-driven grill",
      "enterprise": true,
      "reads": [
        "architecture-rule-catalogue.md",
        "contracts/*-endpoints.json"
      ],
      "references": [
        "reference/catalogue-grill.md"
      ],
      "instruction": "If rule catalogue exists: follow reference/catalogue-grill.md. Per-family checklist, grill depth-first. Consolidated decision-tree ADRs (target 6-8). Cross-reference catalogue open items. Never cut features/endpoints without user approval.",
      "checklist": [
        "Each family grilled, open items addressed",
        "Scope protection checked, ADRs consolidated"
      ]
    },
    {
      "id": "interview",
      "name": "Interview",
      "instruction": "One question at a time, with recommended answer. Explore codebase instead of asking when possible. Challenge terms against glossary. Sharpen vague language to canonical terms. Probe edge cases with scenarios. Cross-reference claims with code.",
      "checklist": [
        "Every design branch walked, terms validated against glossary",
        "Edge cases stress-tested, code cross-referenced",
        "Architecture questions grilled against constraint sheet"
      ]
    },
    {
      "id": "update-docs",
      "name": "Update docs inline",
      "instruction": "Update GLOSSARY.md inline when term resolved, not batched. No implementation details in glossary. Cascade to CLAUDE.md sections when genuine: naming -> ## Conventions, scope -> ## Scope, deps -> ## Architecture, tests -> ## Testing in CLAUDE.md. Never create docs just to cascade.",
      "checklist": [
        "Terms written to GLOSSARY.md immediately, cascades applied to existing docs"
      ]
    },
    {
      "id": "offer-adrs",
      "name": "Offer ADRs sparingly",
      "references": ["../../schemas/constraint-sheet.json"],
      "instruction": "ADR only when all three hold: (1) hard to reverse, (2) surprising without context, (3) real trade-off. Consolidate related decisions into single ADR. Structure with constraint sheet: workload, state, trust, operations, rejected alternative, revisit trigger.",
      "checklist": [
        "Three-gate test applied, ADRs consolidated with constraint sheet structure"
      ]
    }
  ],

  "capabilities": {
    "scope_protection": true,
    "safety_rails": false,
    "convention_enforcement": false,
    "enterprise_context": true,
    "catalogue_grill": true
  },

  "engagement": {
    "emits": ["concerns"],
    "writes": [
      "GLOSSARY.md",
      "docs/adr/"
    ],
    "manifest": true,
    "chain_dispatch": false
  },

  "tone": "Adversarial but constructive - stress the plan against the domain model."
}
