{
  "$schema": "../../schemas/skill.schema.json",
  "name": "grill-me",
  "status": "stable",
  "description": "Interview relentlessly about a plan or design until reaching shared understanding on every branch.",

  "chain": {
    "from": [],
    "to": [
      { "target": "spec", "type": "gate" },
      { "target": "wrapup", "type": "gate" }
    ]
  },

  "steps": [
    {
      "id": "interview",
      "name": "Interview",
      "instruction": "Interview relentlessly about every aspect of the plan. Walk down each branch of the design tree, resolving dependencies one-by-one. For each question, provide your recommended answer. Ask one at a time. If a question can be answered by exploring the codebase, explore instead.",
      "checklist": [
        "Every branch of the design tree explored",
        "Dependencies between decisions resolved",
        "Shared understanding reached on all branches"
      ]
    }
  ],

  "capabilities": {
    "scope_protection": false,
    "safety_rails": false,
    "convention_enforcement": false,
    "enterprise_context": false,
    "catalogue_grill": false
  },

  "engagement": {
    "emits": ["concerns"],
    "writes": [],
    "manifest": true,
    "chain_dispatch": false
  },

  "tone": "Adversarial but constructive - stress the plan, not the person."
}
