{
  "$schema": "../../schemas/skill.schema.json",
  "name": "check-in",
  "status": "stable",
  "description": "Session entry point. Load context, report state, detect enterprise artefacts.",

  "chain": {
    "from": [],
    "to": []
  },

  "steps": [
    {
      "id": "load-state",
      "name": "Load workflow state",
      "reads": [],
      "instruction": "Run ~/.claude/scripts/discover-project-state.sh and read the JSON it prints. workspace: true -> report repos[] (path, framework) and read the root CLAUDE.md ## Repos; Active Workflow lives in each repo. Read Active Workflow from CLAUDE.md. No workflow: detect project type, recommend /triage or /setup. Workflow exists: note active skill, phase, date. Surface unsatisfied obligations from prior cycles.",
      "checklist": ["State loaded and mode detected", "Obligations surfaced if present"]
    },
    {
      "id": "read-concerns",
      "name": "Read concerns and handoffs",
      "reads": ["CONCERNS.md", "docs/_local/handoffs/"],
      "instruction": "Read CONCERNS.md if exists. Parse summary header. Read Open + Investigating + Blocked, skip Resolved. Check docs/_local/handoffs/ for most recent handoff doc.",
      "checklist": ["Concerns parsed", "Handoff doc read (if exists)"]
    },
    {
      "id": "enterprise-scan",
      "name": "Detect enterprise artefacts",
      "enterprise": true,
      "reads": ["architecture-rule-catalogue.md", "contracts/*-endpoints.json"],
      "instruction": "Scan for rule catalogue, endpoint registries, parity systems. If found, check scope and rule compliance for current phase. Surface violations.",
      "checklist": ["Enterprise artefacts checked", "Violations noted"]
    },
    {
      "id": "worktree-hygiene",
      "name": "Worktree and downstream check",
      "instruction": "Run git worktree list. Identify stale worktrees (merged branches). If ## Deployment exists in CLAUDE.md, surface staged-not-promoted and blocked PRs (link, category, status only).",
      "checklist": ["Stale worktrees identified", "Downstream view surfaced"]
    }
  ],

  "capabilities": {
    "scope_protection": false,
    "safety_rails": false,
    "convention_enforcement": false,
    "enterprise_context": true,
    "catalogue_grill": false
  },

  "engagement": {
    "emits": ["flags", "session plan"],
    "writes": [".claude/.setup-prompted"],
    "manifest": true,
    "chain_dispatch": false
  },

  "tone": "Brief. Read state, report, move on."
}
